{
  "$schema": "https://triesap.github.io/leptos_ui_kit/schema/0.9.0-alpha/component-customization.schema.json",
  "schemaVersion": "0.9.0-alpha",
  "contractId": "leptos-ui-kit-component-customization",
  "revision": 1,
  "properties": [
    {
      "name": "--kit-radius-default",
      "scope": "semantic",
      "cssProperty": "border-radius",
      "valueKind": "border-radius",
      "role": "default",
      "fallback": ["--kit-radius-md"],
      "inherits": true,
      "geometryCritical": false,
      "stability": "stable"
    },
    {
      "name": "--kit-radius-control",
      "scope": "semantic",
      "cssProperty": "border-radius",
      "valueKind": "border-radius",
      "role": "control",
      "fallback": ["--kit-radius-default", "--kit-radius-md"],
      "inherits": true,
      "geometryCritical": false,
      "stability": "stable"
    },
    {
      "name": "--kit-radius-surface",
      "scope": "semantic",
      "cssProperty": "border-radius",
      "valueKind": "border-radius",
      "role": "surface",
      "fallback": ["--kit-radius-default", "--kit-radius-lg"],
      "inherits": true,
      "geometryCritical": false,
      "stability": "stable"
    },
    {
      "name": "--kit-radius-overlay",
      "scope": "semantic",
      "cssProperty": "border-radius",
      "valueKind": "border-radius",
      "role": "overlay",
      "fallback": ["--kit-radius-default", "--kit-radius-md"],
      "inherits": true,
      "geometryCritical": false,
      "stability": "stable"
    },
    {
      "name": "--kit-button-radius",
      "scope": "component",
      "owner": "button",
      "cssProperty": "border-radius",
      "valueKind": "border-radius",
      "role": "control",
      "fallback": ["--kit-radius-control", "--kit-radius-default", "--kit-radius-md"],
      "inherits": true,
      "geometryCritical": false,
      "stability": "stable"
    },
    {
      "name": "--kit-collapsible-trigger-radius",
      "scope": "component",
      "owner": "collapsible",
      "cssProperty": "border-radius",
      "valueKind": "border-radius",
      "role": "control",
      "fallback": ["--kit-radius-control", "--kit-radius-default", "--kit-radius-md"],
      "inherits": true,
      "geometryCritical": false,
      "stability": "stable"
    },
    {
      "name": "--kit-dialog-trigger-radius",
      "scope": "component",
      "owner": "dialog",
      "cssProperty": "border-radius",
      "valueKind": "border-radius",
      "role": "control",
      "fallback": ["--kit-radius-control", "--kit-radius-default", "--kit-radius-md"],
      "inherits": true,
      "geometryCritical": false,
      "stability": "stable"
    },
    {
      "name": "--kit-dialog-close-radius",
      "scope": "component",
      "owner": "dialog",
      "cssProperty": "border-radius",
      "valueKind": "border-radius",
      "role": "control",
      "fallback": ["--kit-radius-control", "--kit-radius-default", "--kit-radius-md"],
      "inherits": true,
      "geometryCritical": false,
      "stability": "stable"
    },
    {
      "name": "--kit-dialog-radius",
      "scope": "component",
      "owner": "dialog",
      "cssProperty": "border-radius",
      "valueKind": "border-radius",
      "role": "overlay",
      "fallback": ["--kit-radius-overlay", "--kit-radius-default", "--kit-radius-md"],
      "inherits": true,
      "geometryCritical": false,
      "stability": "stable"
    },
    {
      "name": "--kit-field-surface-radius",
      "scope": "component",
      "owner": "field",
      "cssProperty": "border-radius",
      "valueKind": "border-radius",
      "role": "surface",
      "fallback": ["--kit-radius-surface", "--kit-radius-default", "--kit-field-control-radius", "--kit-radius-md"],
      "inherits": true,
      "geometryCritical": false,
      "stability": "stable"
    },
    {
      "name": "--kit-field-control-radius",
      "scope": "component",
      "owner": "field",
      "cssProperty": "border-radius",
      "valueKind": "border-radius",
      "role": "control",
      "fallback": ["--kit-radius-control", "--kit-radius-default", "--kit-radius-md"],
      "inherits": true,
      "geometryCritical": false,
      "stability": "stable"
    },
    {
      "name": "--kit-input-radius",
      "scope": "component",
      "owner": "field",
      "cssProperty": "border-radius",
      "valueKind": "border-radius",
      "role": "control",
      "fallback": ["--kit-field-control-radius", "--kit-radius-control", "--kit-radius-default", "--kit-radius-md"],
      "inherits": true,
      "geometryCritical": false,
      "stability": "stable"
    },
    {
      "name": "--kit-select-radius",
      "scope": "component",
      "owner": "field",
      "cssProperty": "border-radius",
      "valueKind": "border-radius",
      "role": "control",
      "fallback": ["--kit-field-control-radius", "--kit-radius-control", "--kit-radius-default", "--kit-radius-md"],
      "inherits": true,
      "geometryCritical": false,
      "stability": "stable"
    },
    {
      "name": "--kit-textarea-radius",
      "scope": "component",
      "owner": "field",
      "cssProperty": "border-radius",
      "valueKind": "border-radius",
      "role": "control",
      "fallback": ["--kit-field-control-radius", "--kit-radius-control", "--kit-radius-default", "--kit-radius-md"],
      "inherits": true,
      "geometryCritical": false,
      "stability": "stable"
    },
    {
      "name": "--kit-menu-trigger-radius",
      "scope": "component",
      "owner": "menu",
      "cssProperty": "border-radius",
      "valueKind": "border-radius",
      "role": "control",
      "fallback": ["--kit-radius-control", "--kit-radius-default", "--kit-radius-md"],
      "inherits": true,
      "geometryCritical": false,
      "stability": "stable"
    },
    {
      "name": "--kit-menu-content-radius",
      "scope": "component",
      "owner": "menu",
      "cssProperty": "border-radius",
      "valueKind": "border-radius",
      "role": "overlay",
      "fallback": ["--kit-radius-overlay", "--kit-radius-default", "--kit-radius-md"],
      "inherits": true,
      "geometryCritical": false,
      "stability": "stable"
    },
    {
      "name": "--kit-menu-item-radius",
      "scope": "component",
      "owner": "menu",
      "cssProperty": "border-radius",
      "valueKind": "border-radius",
      "role": "control",
      "fallback": ["--kit-radius-control", "--kit-radius-default"],
      "naturalFallback": "calc(var(--kit-radius-md) - 2px)",
      "inherits": true,
      "geometryCritical": false,
      "stability": "stable"
    },
    {
      "name": "--kit-spinner-radius",
      "scope": "component",
      "owner": "spinner",
      "cssProperty": "border-radius",
      "valueKind": "border-radius",
      "role": "geometry-critical",
      "fallback": ["--kit-radius-full"],
      "inherits": true,
      "geometryCritical": true,
      "stability": "stable"
    },
    {
      "name": "--kit-tabs-trigger-radius",
      "scope": "component",
      "owner": "tabs",
      "cssProperty": "border-radius",
      "valueKind": "border-radius",
      "role": "control",
      "fallback": ["--kit-radius-control", "--kit-radius-default", "--kit-radius-md"],
      "inherits": true,
      "geometryCritical": false,
      "stability": "stable"
    }
  ]
}
